{
  "$schema": "../../shared/sources.schema.json",
  "id": "violetscans",
  "baseUrl": "https://violetscans.org",
  "method": "html",
  "urlFormat": "slug",
  "seriesUrl": "/comics/",
  "chapterUrl": "/",
  "selectors": {
    "seriesGenres": ".mgen a",
    "seriesAltTitle": ".alternative .desktop-titles"
  },
  "proxyImages": true,
  "imageReferer": "https://violetscans.org",
  "search": {
    "ajaxFallback": false
  },
  "color": "#ee00ff",
  "contentRating": "sfw",
  "language": "en",
  "enabled": true
}
