{
  "$schema": "../../shared/sources.schema.json",
  "id": "komiku",
  "baseUrl": "https://komiku.org",
  "method": "wordpress",
  "urlFormat": "slug",
  "wordpress": {
    "readerKiru": false
  },
  "proxyImages": true,
  "color": "#8b5cf6",
  "contentRating": "sfw",
  "language": "id",
  "enabled": true
}
